### ISSUE TITLE
iLO Email alert activation

### ISSUE THREAD

**Issue by astrodb** [lsst-uk/somerville-operations#184]
We need to setup iLO email alerts on all the machines in Somerville to notify us when machines have alerts. This requires setting up Postfix mail servers on the mgmt container and the admin node, so messages can be sent by the iLOs to be relayed through the admin node to the SMTP server on the mgmt container, which will then send the messages onwards.

- [x] Install and configure Postfix on mgmt container
- [x] Install and configure Postfix on admin node
- [x] Test email forwarding from admin node to mgmt container
- [x] Investigate iptables logging and if rules don't permit Mail
- [x] Configure iLO alert emails to send from HOSTNAME@somerville.ed.ac.uk to Mark/Greg/Daniel
- [x] Test email forwarding from iLO through to target addresses

**Comment by astrodb** [comment]
Postfix on mgmt container completed by Greg.
Postfix on admin container completed by Mark.

**Comment by GregBlow** [comment]
Need to test email throughput from a single node, then configure all nodes to use same method (then determine how to push a test to all). 

iLO configuration using an adaptation of https://git.ecdf.ed.ac.uk/gblow/ilo-license-setter should be useful.

**Comment by astrodb** [comment]
Just recalled an important thing to check when setting this up: be sure to set the 'SMTP reverse-path' in the SMTP settings on each machine to a mappable email address like 'root@somerville-mgmt.epcc.ed.ac.uk'. Otherwise the emails will be likely get bounced by the Uni relays for being malformed/non-existent (since the messages will be sent with some default 'admin@ip-addess' address in the header).

**Comment by astrodb** [comment]
Appears there is an issue with the HPE iLO requiring TLS on email. Greg's test connections are failing, with an odd "packet rejected" problem on return comms from the admin node's email relay. The tests return error codes which are indecipherable. Might need to open and issue with HPE to investigate.

**Comment by DP-B21** [comment]
yes it seems like that's what I've come across. I believe the networking is fine since the iLO can ping the SMTP server.

**Comment by DP-B21** [comment]
found this whilst sending test mail from `sv-hhd-12-3` to `sv-admin-0` with `tcpdump` open on sv-admin-0:

```
11:54:00.554501 IP sv-admin-0 > 10.19.1.66: ICMP host sv-admin-0 unreachable - admin prohibited filter, length 72
11:54:11.575794 IP sv-admin-0 > 10.19.1.66: ICMP host sv-admin-0 unreachable - admin prohibited filter, length 72
11:54:14.574421 IP sv-admin-0 > 10.19.1.66: ICMP host sv-admin-0 unreachable - admin prohibited filter, length 72
11:54:20.574497 IP sv-admin-0 > 10.19.1.66: ICMP host sv-admin-0 unreachable - admin prohibited filter, length 72
```

Would we have to look into firewall settings on `sv-admin-0` perhaps?

**Comment by astrodb** [comment]
Yeah, that looks like a firewall issue. Take a look and see if the ICMP ranges required can be opened on the mgmt subnet.

**Comment by DP-B21** [comment]
it seems like a new firewall rule needs to be implemented to allow traffic coming from `10.19.1.0/24`:

```
Chain LIBVIRT_FWI (1 references)
target     prot opt source               destination
ACCEPT     all  --  anywhere             192.168.122.0/24     ctstate RELATED,ESTABLISHED
REJECT     all  --  anywhere             anywhere             reject-with icmp-port-unreachable
```

**Comment by DP-B21** [comment]
it seems like a rule needs to be setup to take in traffic coming from `10.19.1.0/24` range:

firewall on `sv-admin-0`:
```
Chain LIBVIRT_FWI (1 references)
target     prot opt source               destination
ACCEPT     all  --  anywhere             192.168.122.0/24     ctstate RELATED,ESTABLISHED
REJECT     all  --  anywhere             anywhere             reject-with icmp-port-unreachable
```

Am I okay to go on with changes to allow tcp traffic from these ranges to work with smtp?

**Comment by GregBlow** [comment]
Spoke with Daniel about way forward re: changing sv-admin-0 iptables rules to do logging to try and identify problem rule.

**Comment by astrodb** [comment]
Need to set rules to log in order to determine which ones are blocking the needed ICMP packets.

**Comment by DP-B21** [comment]
Hi, I hope you all have a great xmas and new years.
As in the terms of getting the logs i have used `iptables -I OUTPUT 1 -j LOG`
This is the iptables chain with the log rules included:
```
Chain INPUT (policy ACCEPT)
target     prot opt source               destination
LOG        all  --  anywhere             anywhere             LOG level warn
LIBVIRT_INP  all  --  anywhere             anywhere
LOG        all  --  anywhere             anywhere             LOG level notice prefix "IPTables-INPUT: "
LOG        all  --  anywhere             anywhere             LOG level warn prefix "IPTables-INPUT: "
```
These logs should be present `/var/log/messages` however no entries coming from the `sv-hdd-12-13 (10.19.1.66)`

**Comment by GregBlow** [comment]
The log output from this is becoming quite considerable. I am removing the logging rules for now. We may want to put back in with a narrower specification.

**Comment by DP-B21** [comment]
It seems that sending the test mail works now. since xmas there hasnt been any major changes besides of @GregBlow removing the logging from iptables.

Extract from `maillog`

```
Jan 22 16:09:43 sv-admin-0 postfix/smtpd[3348453]: initializing the server-side TLS engine
Jan 22 16:09:53 sv-admin-0 postfix/smtpd[3348453]: connect from unknown[10.19.1.66]
Jan 22 16:09:53 sv-admin-0 postfix/smtpd[3348453]: setting up TLS connection from unknown[10.19.1.66]
Jan 22 16:09:53 sv-admin-0 postfix/smtpd[3348453]: unknown[10.19.1.66]: TLS cipher list "aNULL:-aNULL:HIGH:MEDIUM:+RC4:@STRENGTH"
Jan 22 16:09:53 sv-admin-0 postfix/smtpd[3348453]: SSL_accept:before SSL initialization
Jan 22 16:09:53 sv-admin-0 postfix/smtpd[3348453]: SSL_accept:before SSL initialization
Jan 22 16:09:53 sv-admin-0 postfix/smtpd[3348453]: SSL_accept:SSLv3/TLS read client hello
Jan 22 16:09:53 sv-admin-0 postfix/smtpd[3348453]: SSL_accept:SSLv3/TLS write server hello
Jan 22 16:09:53 sv-admin-0 postfix/smtpd[3348453]: SSL_accept:SSLv3/TLS write certificate
Jan 22 16:09:53 sv-admin-0 postfix/smtpd[3348453]: SSL_accept:SSLv3/TLS write key exchange
Jan 22 16:09:53 sv-admin-0 postfix/smtpd[3348453]: SSL_accept:SSLv3/TLS write server done
Jan 22 16:09:54 sv-admin-0 postfix/smtpd[3348453]: SSL_accept:SSLv3/TLS write server done
Jan 22 16:09:54 sv-admin-0 postfix/smtpd[3348453]: SSL_accept:SSLv3/TLS read client key exchange
Jan 22 16:09:54 sv-admin-0 postfix/smtpd[3348453]: SSL_accept:SSLv3/TLS read change cipher spec
Jan 22 16:09:54 sv-admin-0 postfix/smtpd[3348453]: SSL_accept:SSLv3/TLS read finished
Jan 22 16:09:54 sv-admin-0 postfix/smtpd[3348453]: SSL_accept:SSLv3/TLS write change cipher spec
Jan 22 16:09:54 sv-admin-0 postfix/smtpd[3348453]: SSL_accept:SSLv3/TLS write finished
Jan 22 16:09:54 sv-admin-0 postfix/smtpd[3348453]: Anonymous TLS connection established from unknown[10.19.1.66]: TLSv1.2 with cipher ECDHE-RSA-AES256-GCM-SHA384 (256/256 bits)
Jan 22 16:09:54 sv-admin-0 postfix/smtpd[3348453]: 115971800569: client=unknown[10.19.1.66]
Jan 22 16:09:54 sv-admin-0 postfix/cleanup[3348456]: 115971800569: message-id=<>
Jan 22 16:09:54 sv-admin-0 postfix/qmgr[1596342]: 115971800569: from=<test-sv@sv-hdd-12-13.localdomain>, size=1993, nrcpt=1 (queue active)
Jan 22 16:09:54 sv-admin-0 postfix/smtpd[3348453]: disconnect from unknown[10.19.1.66] ehlo=1 starttls=1 mail=1 rcpt=1 data=1 quit=1 commands=6
Jan 22 16:09:54 sv-admin-0 postfix/local[3348457]: 115971800569: to=<dpizarro@mail.somerville.ed.ac.uk>, relay=local, delay=0.06, delays=0.05/0/0/0, dsn=2.0.0, status=sent (delivered to maildir)
Jan 22 16:09:54 sv-admin-0 postfix/qmgr[1596342]: 115971800569: removed
```

**Comment by DP-B21** [comment]
Sending Mail from sv-hdd-12-13 to sv-adm works. to be tested with mail client (such as outlook) and configure in all of the other hdd nodes

**Comment by GregBlow** [comment]
done with https://git.ecdf.ed.ac.uk/gblow/ilo-license-setter/-/merge_requests/3
